id,name,role,bio,photo_url,ig_url,sc_url,yt_url,presskit_url,order_index
servando,Servando,DJ y productor,"Servando es un DJ y productor argentino en ascenso dentro de la escena global de la música electrónica. Su enfoque sofisticado y versátil le permite moverse entre los géneros, logrando un sonido único y adaptable a cualquier pista. Ha compartido cabina con artistas como Ezequiel Arias, Budakid, Emi Galván, John Cosani y más. Sus producciones son editadas por sellos como Mango Alley, Sound Avenue y SLC-6.",../../assets/artists/servando.jpg,https://www.instagram.com/servandomusic,https://soundcloud.com/servando_music,https://www.youtube.com/@servandomusic,https://servando.dj-presskit.com/,1
luciano,Luciano Bedini,DJ y productor,"Luciano Bedini es DJ y productor de música electrónica, nacido en Pergamino, Provincia de Buenos Aires. Su identidad artística se define por la fusión entre el progressive house, el dub techno y el deep house. Ha editado en sellos como Sound Avenue y Sincity.",../../assets/artists/luciano.jpg,https://www.instagram.com/luciaanobedini,https://soundcloud.com/luciano-bedini,,https://lucianobedini.dj-presskit.com/,2
manu,Manu Pavez,DJ y productor,Manu Pavez es un DJ y productor argentino con una visión moderna y versátil del progressive house. Su sonido se distingue por la conexión emocional con el público.,../../assets/artists/manu.jpg,https://www.instagram.com/manupavez_,https://soundcloud.com/manupavez,https://www.youtube.com/@manupavez,,3
fideksen,Fideksen,DJ y productor,"Fideksen es un DJ y productor argentino con un sonido que combina elegancia, groove y una fuerte identidad melódica.",../../assets/artists/fideksen.jpg,https://www.instagram.com/fideksen,https://soundcloud.com/fideksensound,,,4
kentavros,Kentavros,DJ,"Sebastián Mansilla aka Kentavros es un DJ argentino cuya propuesta mezcla progressive, melodic y deep house.",../../assets/artists/kentavros.jpg,https://www.instagram.com/kentavros_music,https://soundcloud.com/kentavros_music,,,5
p37ro,P37RO,DJ y productor,"p37ro es un DJ y productor argentino con una propuesta marcada por calidez, detalle y texturas progresivas.",../../assets/artists/p37ro.jpg,https://www.instagram.com/p37r0.fragueiro,https://soundcloud.com/user-560556342,,,6
